listing_id,id,date,reviewer_id,reviewer_name,comments
5629995,668068123,2020-09-26,13953472,Penny,"I have stayed at many Airbnbs across the world and sadly this was a very unfavourable and upsetting experience. His communications are quite abrupt and aggressive. We agreed that we would pay an extra 35 pounds for a cleaner halfway through our stay by his request. This seemed strange but we did not wish to lose the booking so agreed. This actually was not for cleaning but for him to have someone check on the apartment. From this check-up he was annoyed we had not left the doors and windows open during the day. However, this is difficult for security reasons on a ground floor apartment and he knew we were working during the night and were asleep during the day. <br/><br/>Despite his accusatory messages, we agreed to try our best to do this. However, this was sadly not the first example of accusatory/aggressive communication.  When we asked about an outside bin and the collection days he abruptly voice messaged us to say use the neighbour's bins and look on the internet. These were not massive issues but set the tone for his future communications. Near the end of our stay, he said we had to say exactly when we were leaving. We explained how that was difficult as we were being collected by a friend after work as we were moving all our things elsewhere in the country. We had to leave in a rush when our friend arrived and accidentally left my new AirPods in the room. When we asked about these he was aggressive about how we had not told him we were leaving. He later sent an image of a stain on the table. We had not noticed this on the table. He accused us of destroying his 1000 pound table. This seemed both a rather excessive claim considering how it looked like wear and tear from the picture and rather expensive when the whole apartment is furnished with Ikea furniture. We then looked for the table on Ikea and it is 120 pounds, not the 1000 pounds earlier stated. He then continued with these aggressive messages and what felt like bullying tactics to get money. He did not want us to go through Airbnb for resolution. When we said would go through Airbnb he also noted how he has the Airpods but we will not get them back. <br/><br/>Overall, it is a shame that his overly emotive, aggressive and controlling communications have led to an upsetting experience which has also led me to have lost my property in my Airpods. Consequently, I cannot recommend Alberto as a host."
44162944,433152832583040787,2021-08-20,176828351,Ekaterina,"The stay was very good! The place is very nice. It’s quite pricey, but it’s understandable and justifiable in my opinion. Location is perfect. I was on the 13th floor, and the view was amazing. The studio had a kitchenette, and cutlery, pots and pans were provided. The building has security on site at all times. The laundry facilities were good, the app was very convenient to use. Very nice table in the room with a comfortable chair to study. I have stayed over a month, and found it very comfortable. I would recommend staying at Chapter!"
7600355,293346551,2018-07-20,2819356,Martina,"I had booked a room at Colin's house for a friend. He was very happy and enjoyed the breakfast, which is a lovely extra you usually don't get through airbnb. Living in the same neighbourhood than Colin, I can tell that it is a pretty and safe area, quiet at night and gives you a break from the Londoner buzz. I would definitely book again a room for my friends at Colin's. "
32108857,514518480,2019-08-21,182134973,Massimo,"Il soggiorno nell'appartamento di Anish è stata una bellissima esperienza per tutta la mia famiglia. La descrizione corrisponde esattamente alla realtà, e per ogni domanda che ho fatto ad Anish prima della prenotazione, ho avuto una risposta rapida e molto precisa. Anish è stato un ospite veramente perfetto, e quando siamo arrivati ci ha accolto con molta cordialità (e ci ha fatto trovare alcune cosa da mangiare e da bere). Lo spazio nella casa è più che perfetto per 4 persone, con 2 camere da letto e un ampio soggiorno dove poter mangiare e rilassarsi. La cucina, separata dalla zona giorno, è dotata di tutti i comfort (frigo, congelatore, fornelli, forno, microonde e macchina per caffè all'americana). La zona poi è veramente tranquilla, un quartiere residenziale tipicamente inglese, a pochi minuti dalla stazione ferroviaria di Norbiton, da cui si raggiunge il centro città in 25 minuti. In conclusione, assolutamente da consigliare!<br/>The stay in Anish's apartment was a wonderful experience for all my family. The description corresponds exactly to reality, and for every question I asked Anish before booking, I had a quick and very precise answer. Anish was a really perfect host, and when we arrived he welcomed us very warmly (and made us find some things to eat and drink). The space in the house is more than perfect for 4 people, with 2 bedrooms and a large living room where you can eat and relax. The kitchen, separated from the living area, is equipped with all the comforts (fridge, freezer, stove, oven, microwave and American coffee machine). The area is then really quiet, a typically English residential neighborhood, just a few minutes away from Norbiton train station, from which you reach the city center in 25 minutes. In conclusion, absolutely recommended!"
3253348,176064986,2017-07-30,127646149,炜悦,房间挺好的，和图片上的几乎一样！房东人也不错，不怎么出现。房子非常靠近公交车站，离市中心也不太远，就是门牌号比较难找，28-30几在一起有一块牌子
326633,29107786,2015-04-04,27579690,Nimrod,"The apartment itself is really nice.<br/>The location is not ideal since there's no subway station nearby. Using buses and the train is OK if you're not in a hurry.<br/>Please also note the flat is in the third floor with no elevator.<br/>The overall experience was fine, I enjoyed staying in the apartment very much"
42582223,749404751,2021-04-17,128325082,Louisa,Warm and cosy.  Very clean throughout and bed was comfy. Access was a bit confusing.
2209431,143504262,2017-04-12,46929383,Claire,"Nous sommes venue en famille avec 4 enfants dans la maison de Hua. Sa maison est adaptée aux enfants qui ont prient plaisir à jouer chez elle et dans son jardin. Sa maison est équipée pour voyager léger avec: lave vaisselle, sèche linge, machine à laver, sèche cheveux, serviettes de toilette. Nous sommes à côté de magasins pour réaliser des courses alimentaire et du métro. Nous sommes à 20 Minutes du centre de Londres et 1h de l'aéroport heatrow. Hua est une hote très discrète. Nous avons passé un excellent séjour et nous reviendrons chez Hua pour nos prochains séjours à Londres."
22905589,481055108,2019-07-04,157774868,Watinee,The host canceled this reservation 93 days before arrival. This is an automated posting.
8477795,164621692,2017-06-28,62641084,Russell,Second time we stayed here. Very clean and peaceful accommodation. 
2659707,300880947,2018-08-03,80461298,Shraddha,"Absolutely loved the way you have decorated the room and the stuff in it is very well thought of. Everything in the house has an artistic touch. Overall we had a pleasant and memorable experience, especially being our first airbnb stay."
18523912,409605552,2019-02-08,36451095,Heather,"Outstanding location, spacious, stylish apartment and great host."
15978828,280073784,2018-06-22,13353948,Morgan,"The flat is perfectly located, very clean and Lior was very available for my questions ! "
9815898,88411654,2016-07-24,51903603,Sophia,"Had a lovely stay in Franklyn's house, it's very homey and comfortable. The kitchen was very well equip and everything we needed was provided. Will definitely stay here again!"
15231540,264629226,2018-05-14,74010675,Dagmar,"Emilly was the perfect hostess. After we arrived, Emilly gave us a quick neighbourhood tour and explained how to get around London. The house was super clean, well maintained and perfect for our group of 6 persons. <br/>We can safely recommend Emilly's accommodation to friends and family.<br/>As a welcome there was free wine, water and coke, milk for coffee.<br/>The kitchen is equipped with everything you need: enough dishes, pots, pans; in the bathroom there are even showers, creams, plenty of toilet paper. We were able to park our car on a parking lot belonging to the house.<br/>Central London is easy to reach from the house: there are railway stations and bus stops nearby.<br/>In short: it was also through the beautiful accommodation a wonderful stay in London.<br/>Thanks again Emilly - you are truly a wonderful host!"
26061569,577315317,2019-12-15,200572267,Csilla,Olha was a great host. She is very welcoming. The room is very comfortable and the flat has an excellent location. Greatly recommended.
14300513,145815949,2017-04-20,85943354,Sara,"Max and Billie's was a delight to work with, quick to respond and check in/out was easy. This studio apartment is in a perfect location, away from the hustle and bustle of Piccadilly Circus, but not too far that you can hop on the Tube or walk to Kensington. The neighborhood is quiet, but within a block of a major street for easy access. There is a lovely local coffee shop around the corner and great restaurants walking distance away. You truly get the local feel staying here, I'll definitely be back!"
42953478,659034934,2020-08-31,164955547,Kian,"Great location, clean, good amenities"
11918476,558676406,2019-11-03,37882810,Thomas,Anne est tres accueillante et disponible avec une réelle attention pour ses hôtes
17138050,253874771,2018-04-15,110978350,Marina,Everything was wonderful. Thank you
9701569,110609313,2016-10-27,29797883,Christian,"Super accueil de la part de Craig, très disponible et réactif via SMS. Le logement est conforme à la description, il y a 2 chambres donc un peu juste pour nous 7 idéal, pour 4 à 5 afin de garder un salon dégagé. Appartement très sécurisé, calme et très bien situé, commerces et métro à 2 minutes à pied accès au centre de Londres en 20 minutes en métro. "
