listing_id,id,date,reviewer_id,reviewer_name,comments
21704321,611933808,2020-02-28,1940771,Rachel,"Booked this last minute and late & her family were great, very warm & welcoming, wouldn’t hesitate to stay here again. Great, hospitality house & location! Thank you"
18767046,427779460,2019-03-24,209327954,Kevin,"Ideal location for central London, clean and everything as described , no dramas<br/>Would return  if we were looking to stay in Kensington"
24254702,278946508,2018-06-19,122896932,Jennifer,Great clean quiet flat
1517086,476903703,2019-06-27,269304396,Hannelore,"Leider hatten wir Pech mit der Wohnung, da Schimmelflecken und Schimmelgeruch als auch eine gewisse Unsauberkeit ( Haare und Flecken) uns zwangen auf Hotelzimmer auszuweichen und wir nun die teure Wohnung als auch 3 Hotelzimmer zu zahlen hatten. Mit der Gastgeberin war leider nicht zu reden, sie war zu keiner Kulanz bereit, sogar die Reinigungskosten wurden nicht rückerstattet. Insgesamt keine gute Erfahrung, denn wir hatten viel Stress und hohe Ausgaben."
19776668,232770402,2018-02-06,41555669,Emily,"This was our second stay at Ingrid's apartment and we enjoyed it thoroughly again. The place is spotless, in a good location and everything you need is provided. Ingrid is friendly, helpful and really easy to communicate with. We'll stay again!"
5300840,318759635,2018-09-04,19143618,Nina,"I had a wonderful stay, sadly only one night, which was quiet, comfortable and had everything I needed. James was prompt in his communication, and a super friendly host who's great to have a chat with. Hoping to stay again in the future!"
15161649,344760380,2018-11-04,59556089,Jeremy,"Alan is a great host and makes you feel right at home. my friend was really hungover in the morning and left later than the check out time and Alan wasn't bad about it. would recommend the place, it's simple and somewhere to rest your head."
14629205,278643997,2018-06-18,28769602,T-Hom,"My third stay in London, this was one of my favorite spots. Highly recommended."
2659707,420990110,2019-03-08,238100735,Maik,"This was my first stay with airbnb ever and definitely not my last. <br/><br/>Katherine and Craig are really nice and helpful with all issues we had! <br/>Also their cat „sausage“ is very lovely :)<br/><br/>The accomodation is perfect when you want to have a city trip to London. <br/>It does not take too long into the centre. <br/>Also, you can have a nice breakfast every morning before you leave to the sights. <br/>The room has everything in it what you need and even more. <br/>There is wifi available and you could play xbox or watch tv and netflix if you feel like. <br/><br/>In total, it was a very good experience!!!"
6982659,73500113,2016-05-08,68389216,Thomas,We loved the room and everything was provided. A Lovely clean simple room with a nice en suite. Neighbourhood felt really quiet and safe and really close to tube. 
45491001,423682296682430450,2021-08-07,212749877,Kwesi,"Great price for place, was a little smaller than pictured but it did the job. Great communication and amenities!"
21294445,206014338,2017-10-23,107533752,Charlotte,The host canceled this reservation 3 days before arrival. This is an automated posting.
13905660,454994584,2019-05-19,109773599,Joanna,Our hen party weekend was fabulous but unfortunately the host did let us down with the property. We made the best of it as it was only for one night and didn't let it dampen our spirits.<br/><br/>The place needs a proper thorough clean and the beds do need looking in to - some were very nice but a lot of them we found far too uncomfortable to sleep on.<br/>All in all a good place to crash for a party but we wouldn't want to stay there for longer than one night.<br/><br/>It's a shame I am having to write this review as I have actually never left a bad review about  anything but I wanted to be honest.<br/><br/>The lady who met us for check in and out was fantastic though so thank you to her and for the bottle of prosecco!
18007955,149457983,2017-05-04,79127271,Sayo,Room as described.<br/>Coffee and biscuits. Very nice welcoming. Buses and shops very close. I would recommend this room as it's good value and our hostess and her son are really nice to meet.
11375998,510717094,2019-08-16,38585887,Olu,"Katy's home was the ideal place to host my family of 6 from Nigeria, everything was just as was described and as in the photos. It feels very homely, and spacious. Very quiet neighbourhood too with parks and amenities all within walking distance. Location was just perfect, if you want to take the bus or tube, Turnpike lane and Finsbury Park stations serving the Picadilly and Victoria lines are just a few stops away. Katy also is a great host, checking in every now and then to make sure we were alright and ready to provide anything we needed. Grateful to be have been entrusted with your home."
15465132,462571330,2019-06-02,260536389,Daniela,"we had a great time in this cottage in the suburbs, the neighborhood is adorable and well served by the means and everything you need for your stay. I personally met Elsa who was extremely available for our needs. I would go back again!"
29759917,473759455179386930,2021-10-15,164423901,Kim,Nice place and good access to Islington.
7183377,299693627,2018-07-31,12730875,Doug,"The one thing other reviews don't quite seem to capture is just how nice the back garden experience can be. Eleanor's windows slide away and give you complete access to the lush garden. It is nicely lit and is particularly lovely before the dawn or after the sun has set. The home is very comfortable and good for a family of four (although the bunk beds are best for kids who aren't too tall - and if your kids are very young, be aware that there are stairs that don't have a railing). One of our favorite things was the bedding in the master bedroom - four great pillows and a comfy duvet (kind of a rare find in our Airbnb experiences). Finally, as others have said, Eleanor was incredibly responsive and helpful."
15143351,328467512,2018-09-26,217096350,Gill,"A warm and welcoming family home. My room was spacious, with plenty of storage and a very comfortable bed. The tea and coffee facilities are a nice touch too. Excellent value and I would have no hesitation about booking again."
3196599,164987129,2017-06-30,56408234,Jenny,"Andy's place is SO convenient to everything in Clerkenwell/Farringdon.  Compared to most places in London, it's incredibly spacious!  You have a totally separate living room with two sofas, full kitchen and then spacious bedroom with dressers and a wardrobe.  <br/><br/>Being American, I was a little hesitant to stay somewhere without A/C but the temperature was perfect, even on hot days.  It's in a central location but also so quiet!  We slept with the windows open one night and it was almost silent, which is unheard of in the city.  <br/><br/>Great place that I would highly recommend and Andy is SO accommodating.  He was texting me from the minute I landed to coordinate my check in, which changed a few times and then was in touch throughout the stay to ensure we didn't need anything.  Highly recommended! "
310949,249959480,2018-04-03,166296269,Meg,"My husband and I arrived in London a snowy evening. It's Robert and Antonio cooked a nice dinner for us and gave us a very warm welcome. The house is clean and comfortabe, we do love the lake in front of the house. The shopping centres are about 10 minutes walk, we bought the food we liked and cooked our dinner most of the time. We stayed there for 16 nights. Though it took us a little bit long time to take the bus and train to the city centre and different towns nearby, we enjoyed the journey. We really appreciate the owners' help."
50362673,425083151538244883,2021-08-09,29472860,Heather,"This was a comfortable stay for our family of 3, including a 4 year old.  Plenty of room for us all, comfortable beds, and a surprisingly big back yard!  The place could use a bit more upkeep, but I think this is a new endeavor and those things will work themselves out over time.  Great communication, and easy check-in."
8728789,466593853,2019-06-09,100820604,Hannah J,The place was clean and just what we needed for a few nights in London.  Tom was helpful and let us check in early for a nap after our overnight bus. It's about a 10 minute walk to the Brixton tube station.  We really enjoyed our stay!
45795787,390372240374266451,2021-06-22,198663189,Misha,"The VUE IS INSANE! The place was clean and absolutely delightful!<br/><br/>Will and his team are awesome, professional and always on point.<br/><br/>Thank you for a beautiful stay will be returning soon!"
6996677,364314590,2018-12-30,20978443,Karine,"Vittoria répond facilement à toutes vos questions et son appartement est joli, très propre et bien situé. Très bon sejour chez vittoria"
14299729,97732193,2016-08-28,6738575,Katherine,Max and Billie were really flexible about picking the keys up and let us store our luggage in their office while we explored london for the day. The studio was exactly how it was on the photos and there were absolutely no surprises. Max and Billie even left us some welcome chocolates! We had a lovely time staying in this studio and the location is perfect for an authentic London experience. 
19968804,516518727,2019-08-24,198482230,Ian,"Room is nice an clean, bed was comfortable and has plenty of room for 2. Host was very responsive and helpful, and had left lots on nice extras in the room (water, cereal/breakfast food , reduced price for the set menu of the restaurant below).  Only downside was a smaller bathroom that had flushing/noise at random intervals from the plumbing"
2119937,366804404,2019-01-03,34068870,Carina,"We were out a lot and didn't see much of our hosts, but Soren still texted us during our stay to check if everything was fine and even brought us fresh towels after a few days. The room was nice and it was very convenient to have an own bathroom and an own entrance. Check in and check out were very flexible and we were happy that we could leave our luggage until we left for the airport. We had a lovely stay at Sorens place and can definitely recommend it. Thanks again!"
5081461,323752108,2018-09-16,1677254,성환,"가격대비 아주 훌륭합니다. breakfast가 좋습니다. 아주 청결하고 아늑한 방을 가지고 있습니다. 시내에서 멀긴 하지만, 처음만 좀 어려울 뿐 버스 (106번) 타고 finsbury 역만 나가면 어디든 쉽게 갈 수 있습니다. 저의 영국 여행 일정이 바빠서 호스트와 많은 시간을 보내지는 못했지만, 세심한 배려를 해주시는 좋은 호스트입니다."
4022582,72813800,2016-05-04,8288043,Zsofia,"I am very happy for the couple of nights I stayed by Naomi in her wonderful home. She is very lovely, welcoming host and her home is just as fantastic as on the pictures. The room is cosy, full of light and very nicely furnished. Naomi's two cats, Bubbles and Magic, were like the cherry on the cake for me. Thank you, Naomi!<br/><br/>"
28279185,540846899,2019-10-04,23760448,Kendal And Lorraine,"We had a delightful room with an equally delightful outlook. The room was cosy, very clean and had everything we needed. It was close to shops, cafes and public transport. Julie was a lovely host who made us very welcome. Her communication was outstanding. She even managed to map out a good economic way to get from Gatwick Airport to her house and were to buy an Oyster card en route."
10038491,98225245,2016-08-30,66282537,Katie,"We are a family of six so it's not easy to find affordable accommodation for us in a city like London. However, we struck it lucky with Emily's house. Location was perfect within in easy reach of Homerton station and we traveled to the centre of London every day with 4 small kids. Emily was a fantastic host and we would highly recommend her house. The local area is lovely too, full of little shops & cafes with in easy reach. Thank you Emily "
21261911,423186861,2019-03-13,69752103,Alex,"Bright, quiet and a great location. I had a wonderful stay."
14082295,230836729,2018-01-29,59856914,María,"Nuestra estancia en el apartamento ha sido muy buena. Un apartamento tal cual se indica en las fotos, con buena ubicación, cerca de la parada de metro, y perfecto para 3 personas. Nuestra estancia ha sido muy agradable."
39102396,640817539,2020-07-21,138140054,Rosana,"Kevin was a great host, very respectful."
8882223,60599513,2016-01-25,40203227,Tiffany,"Juliano was the perfect host. He was attentive, detailed and thoughtful in preparing the flat for guests! The flat is beautiful, centrally located (close to the tube and sites) and I could not have asked for a better experience!  Hope to stay there again!"
23374477,314877985,2018-08-27,210455881,Sara,"Very good location right in front of kings cross and st Pancras station. It can be a bit too noisy at night, but we were expecting it, due to the location. It is a well served area. The room is small but has everything you need and is clean. "
27863349,510486019,2019-08-16,261192320,Lorie,"Quiet, clean accommodation.  Close enough to walk to many sites and minutes from St Pancras/Kings Cross.  4 rooms in total with 2 shared bathrooms and shared kitchen but no issues with either.  Hosts are friendly and respond promptly to emails.  Enjoyed our stay here."
21263625,304932964,2018-08-10,204404411,磊,"It's a good location near the Surrey Quay and with the nice view. The owner Veronica is very kind to allowed us check-in earlier, and responded very quickly."
16386228,333339823,2018-10-07,61793226,Lea,"Lovely apartment offering everything you need. Great location and easy check in. Natasa was very helpful and provided lots of useful tips on the flat and the area, transport etc. Thanks for everything  :)"
30205947,545000813,2019-10-11,118180932,Sarlote,"Ivan is a great and generous host, this is really the perfect location. Close to buses and trains. Many restaurants around. This is a very large room for London, especially for the price. Loved the availability of a use of kitchen and the provided breakfast."
42784865,505595105240213179,2021-11-28,248873474,Frederic,"Parfait !<br/>Tres bel appartement, calme, spacieux et très confortable,  a proximité des transports. Bel emplacement pour visiter Londres !<br/>Très bonne communication avec l'hôte :  merci encore à Stephane."
29486189,442358427,2019-04-23,24782422,Michel,"Appartement cool et parfaitement adapté pour 8 voyageurs<br/>L’emplacement est idéal pour visiter Londres<br/>Le quartier est très sympa avec tout les commerces<br/>Nous n’avons pas vu David , mais la communication a été très précise et claire tant pour l’arrivée que pour le départ . Merci à lui<br/>Nous recommandons cette location"
7085928,403162998,2019-01-20,230825946,Natdanai,A great place with an equally wonderful host. This will be my first choice for a place to stay in London for the foreseeable future.
17226911,174770186,2017-07-27,71561362,Judy,"We would stay here again! Great for a family trip, couples"
18189287,553991099,2019-10-25,93487357,Lars,We stayed in Ingrid's apartement with our daughter (16) for 6 days and traveled by car. We had a great stay in this spacious and well equipped apartement and felt like home. Everything was as described and very clean. We went to London by bus and underground (Picadilly + Metropolitan) without any problems in 1 hour. We would like to come back again.
389967,164941300,2017-06-29,40606719,Ashley,We had a lovely stay while we were in Wimbledon. Frances was a wonderful host providing us a nice breakfast every morning and working around our schedule. The room and bathroom was well kept and very clean. Beds were comfortable also. We were able to walk to Wimbledon village within 15/20mins. There were plenty of restaurants to choose from in the village for dinner etc. Overall a great place to stay!
1941845,433514262,2019-04-06,11486328,Ruth,"We unfortunately never made it to Colum's place as our gearbox failed on the M5, however I've given Colum five stars as he couldn't have been more understanding and responsive. He made a very stressful situation a lot less stressful and for that we were very grateful, particularly with a 14 month old in tow! Fantastic host!"
19929424,229588741,2018-01-24,3765541,Barbora,"cute place, warm and cozy. good address, good communication, thank you max!"
17236799,136094346,2017-03-08,60241452,Alisa,Todd went above and beyond making us feel comfortable!!!  He even gave us a tour of London and was very helpful!!!  We really enjoyed his company and our stay with him was great!!!  Definitely worthwhile to stay here!!
6968345,500537812122030571,2021-11-21,417860061,Libby,Rhian is such a lovely host - very understanding and flexible about check in. The house is gorgeous and very very clean! Thank you!
14681392,662891293,2020-09-11,68201457,Matthew,"The room was very clean and spacious. The whole place was very nicely decorated as well. The location is also good as it’s in a leafy area of London in a quiet neighborhood, but still not too far from the centre. The check-in/out was easy as well.<br/><br/>The only thing we think could be changed is removing “breakfast included” as we were not given any information about it when we arrived and felt that it wasn’t really included. We wish it was not stated in the listing so that we could have prepared better for ourselves.<br/><br/>But overall good stay at Kirstie’s!<br/><br/>Thanks,<br/>Matt & Hyemin"
25811402,425529761,2019-03-18,84582066,Kathryn,Extremely clean and close to airport! Perfect for a layover a bit too long to stay in the airport!
6475256,165937218,2017-07-02,135891009,Sanja Maria,"The oval house is definitely the best place to stay at in London specially if you travel alone, like I did because you will never feel  alone in this house :)<br/>the house is filled with absolutely wonderful, big hearted, super lovable people you will want to stay friends with forever!<br/>It's location is perfect, bus stops right in front of the house, tube station is a 3min walk away but you can even be at london bridge in 30mins by foot.<br/>Stores, cafes, bars, restaurants and bakeries are right next door or around the corner.<br/><br/>I stayed here for an entire week. I felt super welcome and never lost because they would always help me find the best way to my next destination, make suggestions for other good places to check out or just have me spending good times at the house with them. <br/>Loved it so much! I will absolutely be back!!!<br/><br/>"
22046992,521014377,2019-08-31,261217389,Patrick,"One of the best flats I have ever stayed in london. Hendon, great area, 24hr supermarkets in 5min walk, right next to middlesex uni, loads of parks around. It's lovely place!"
38278822,563914533,2019-11-14,11123870,Helle,"Location , location, location doesn’t come any better ! <br/>Alex flat is very nice and modern, absolutely loved it. Would definitely go back."
18434227,158045424,2017-06-05,121528830,Marine,"Un très chouette séjour, ce sont des hôtes très gentils et bienveillants qui ont été à notre écoute. Le logement est idéalement situé, avec une ligne de métro direct sur le centre de londres (Oxford circus : 15-20min). C'est un logement familial cosy, très propre et soigné, dans un quartier résidentiel calme. Nous n'hésiterons pas à y retourner pour un prochain séjour :) <br/><br/>A very nice stay, they are very kind and caring hosts who have been listening to us. Housing is conveniently located, with a direct metro on Central London (Oxford circus : 15-20 min). It is a cosy family housing, very clean and neat, in a quiet residential area. We would not hesitate to go back for a next stay :)"
3581653,138901460,2017-03-22,23730320,Annabel,"Alex is a great host. Very flexible with arrival and departure arrangements, which was really helpful for me. No complaints!"
7898874,144660226,2017-04-16,113849047,Juan Gabriel,"Nice location, very central, with supermarkets around."
11072802,135117784,2017-03-03,106461000,Michael,Great little spot - very self-contained with a great bathroom. Would definitely stay there again.
25554748,761358045,2021-05-23,370843801,Isabel,Really good value apartment - location is super convenient and the flat had everything we needed! Would definitely stay again
13478176,101464547,2016-09-13,83497525,Saeed,"No i do,n have any think<br/><br/>"
538558,481632089880462015,2021-10-26,7557316,Joshua,Comfortable basement apartment in the heart of Bloomsbury.
49609623,465045000676899904,2021-10-03,64650512,Trevor,Excellent
21523290,552632223,2019-10-22,108514025,Oliver,Octavia的房子地理位置很不错，位于地铁circle线上，抵达各个景点和火车站非常方便。房间很大，两层楼为一层地面一层地下室，各种设施应有尽有。房内有许多房主的物品非常温馨可爱，也有足够的空间放行李。房源唯一不足的是楼上浴室水压不足，洗浴不是很舒服。
8989885,63193687,2016-02-21,42581872,Christopher,I had a very great stay at Anita's lovely clean flat. Highly recommended!
12052198,225426833,2018-01-06,4146987,Nina,"We had a wonderful stay at Colin's place. The location was perfect - slightly away from the main tourist attractions but in an area with lots of shopping, great local restaurants and several grocery stores nearby. <br/><br/>Colin's wife Julia was always quick to respond and provided recommendations for dinner spots nearby. <br/><br/>The apartment itself was warm, comfortable and very stylish. A big plus for our kids was getting to play with toys, having stepping stools and other small details they are used to at home but you don't get in a hotel. <br/><br/>On our last day our flight was delayed but Julia and Colin were very flexible letting us stay as long as we needed to."
40728728,759845099,2021-05-18,401111284,Magdalene,Lovely location and lovely place!
19718216,268579630,2018-05-25,178375284,Christine,"The flat has the best location ever! John's place is close to the tube station and needs only a few minutes walk.  It's extremely important while you are traveling with small kids.  Multiple local restaurants and two large supermarkets are located in the neighborhood      John/Ann-Sofi are also very nice and responsive to answer all my questions. Overall, we had an excellent stay in London and would definitely book this flat again in the future!  "
10827526,322214580,2018-09-12,57770556,Dave,"I had an absolutely amazing stay at Siobhan’s place. It’s really gorgeous and homey, and the location was ideal. That being said, Siobhan herself topped her perfect flat. She’s incredibly helpful, smart and funny, and hanging out with her when she was around was easily one of the best parts of my stay in London! I couldn’t recommend staying there more."
51254362,479543155419685390,2021-10-23,34258900,Steven,"Great location, check-in couldn’t be easier and good value, I will book again."
11331179,497359296,2019-07-28,35373565,Jaclyn,The location is perfect to visit the museums and have meals. The room is crowded for two adults and two children.
14704851,135134598,2017-03-03,97471299,Olivier,vous pouvez loué cet appartement les yeux fermés.<br/>super propre et bien situé dans le quartier de tower bridge.
49355329,444008763640470576,2021-09-04,46181353,Gail,"Great apartment in a great lovely location.  We love Camden.  Bar next door was a bit noisy on Friday night, but didn’t bother us.  Large grocery store with absolutely everything right across the street - easy access to underground and buses - 1 block down.  Clean, spacious, and well stocked kitchen for breakfast at home.<br/>10 + coffee shops with a few blocks - oodles of restaurants in the area.  Loved our stay "
17216211,208600803,2017-11-02,108434654,Zan,"Adrian was an excellent host, very welcoming. Nice bedroom, very comfortable and clean. The bathroom was spotless as well as the rest of his appartment. Great experience overall. Highly recommended."
15531309,321420600,2018-09-10,75697374,Romain,Adrian est très réactif et l'appartement est top !
53444256,505620741829639945,2021-11-28,144593357,Ashmita,"Great place to stay, exactly as advertised. Nice attention to details such as providing kitchen roll, bottle of water, small portable sanitiser bottle, etc. The host is lovely and responsive. A supermarket was nearby too.  I would definitely stay here again."
17691357,196963454,2017-09-24,48724286,Brad,Liz is a gracious host. Her place is centrally located as explained in profile. The room was clean and spacious. The neighborhood is very chic being literally across the street from Hyde Park. I would recommend her place to a friend.
46137080,748438886,2021-04-13,189663783,Jules,Great host!
